{
  "schema_revision": 1,
  "canonical_profile": "alpheus-c14n-v1",
  "release_id": "ap0-lean-v1-6c276e9",
  "stage": "AP0",
  "decision": "authorized",
  "source_commit": "6c276e9d740bf6c20b7e22b53f6ee06c131ecb7d",
  "created_at": "2026-07-20T00:07:41Z",
  "authorized_by": {
    "principal_id": "JackZhao98",
    "kind": "user",
    "audience": "activator"
  },
  "effect_ceiling": "none",
  "documents": [
    {"path": "docs/agent-plan/BUILD_ROADMAP.md", "digest": "029e0400cae544f91759680fe203d7eb0ad27f2b75acf828bd127ff354588809"},
    {"path": "docs/agent-plan/FINAL_ARCHITECTURE_AUDIT.md", "digest": "d24e70636d5aeb91bd4dba2bfc5f528c0f03aa5700d87bd32e6c4999c13fb32e"},
    {"path": "docs/agent-plan/LEAN_V1_AMENDMENT.md", "digest": "3f14679bde6eaa8060fe28f127dee8e738c9d9f6d66fc2a96e1b9459c03ffa53"},
    {"path": "docs/agent-plan/SYSTEM_BOUNDARIES.md", "digest": "745b7ce72540e5fba3ecccc91f3f4978e692fc46ed49dedbc79393d6539a43b7"},
    {"path": "docs/plan/08_DEFERRED_CANARY.md", "digest": "24f64e5dfe53f572581d3d39e8237bee4e6e27b68ed1825694979336c8f35c5a"}
  ],
  "checks": [
    {"name": "blob_store", "status": "pass", "evidence_digest": "6e248382e3a8884dca1a1aaf9a06783e95e1a6319dff274714e1f84eaba215de"},
    {"name": "clean_worktree", "status": "pass", "evidence_digest": "d009c1355e6bb51a3be8b0b7c51bfaa2610abafe62122ebd3fab7c382fc0b059"},
    {"name": "compose_config", "status": "pass", "evidence_digest": "efd3fe6d82f83e0e165b52d9113f35974626d3b3f00f06c6148884a1a126fbc7"},
    {"name": "contract_schema", "status": "pass", "evidence_digest": "8783bc0043f33eb9be975d2f97a13252438ea5b27e1d8150722413e3a90ffde3"},
    {"name": "db_delivery", "status": "pass", "evidence_digest": "312b953d1e2e74edbc9cccbb421d4198bb4c64942983bfa29df1954f45aa0cbd"},
    {"name": "go_test_race", "status": "pass", "evidence_digest": "8ea7029fcb51a1cd248d5bc767b074a533e31b8bc37d88e6ffa87d48a8e600fd"},
    {"name": "go_vet", "status": "pass", "evidence_digest": "3d2da162bc70dc2f58ff46477247fa9c5bca96e99135a41cbea9e9ebfe354059"},
    {"name": "gofmt", "status": "pass", "evidence_digest": "4c4d17bbb6c313263c8353c387dcd9013b6bb789443435900f31a9bd40dea43f"},
    {"name": "governance", "status": "pass", "evidence_digest": "a807d4e103e50032eacb8001ce7d00cf16af901013b67cc166cb161dee2d44d7"},
    {"name": "migration_compatibility", "status": "pass", "evidence_digest": "5a8864038a3494bd7d0cb3887a830642f4da5878c2150f6955bc85e04a975cde"},
    {"name": "nonmoney_boundary", "status": "pass", "evidence_digest": "57929e854d5d1ca7b009bb2587f5e2c9e56462def4b01163d60df8780161e663"},
    {"name": "secret_leaks", "status": "pass", "evidence_digest": "bd608c97baffa5cf0aaeb67f3617131598d6ab6673b546a22ed2d9918997a7aa"}
  ]
}
